<?xml version="1.0" encoding="UTF-8"?>
<xs:schema xmlns:xs="http://www.w3.org/2001/XMLSchema" elementFormDefault="qualified">

    <!-- Root element -->
    <xs:element name="order">
        <xs:complexType>
            <xs:sequence>
                <xs:element name="orderId" type="xs:string"/>
                <xs:element name="description" type="xs:string"/>
                <xs:element name="requestDate" type="xs:date"/>
                <xs:element name="lineItem" maxOccurs="unbounded">
                    <xs:complexType>
                        <xs:sequence>
                            <xs:element name="book">
                                <xs:complexType>
                                    <xs:sequence>
                                        <xs:element name="bookId" type="xs:string"/>
                                        <xs:element name="bookName" type="xs:string"/>
                                        <xs:element name="genre">
                                            <xs:simpleType>
                                                <xs:restriction base="xs:string">
                                                    <xs:enumeration value="science-fiction"/>
                                                    <xs:enumeration value="mystery"/>
                                                    <xs:enumeration value="thriller"/>
                                                    <xs:enumeration value="drama"/>
                                                </xs:restriction>
                                            </xs:simpleType>
                                        </xs:element>
                                        <xs:element name="publishDate" type="xs:date"/>
                                        <xs:element name="author" maxOccurs="unbounded">
                                            <xs:complexType>
                                                <xs:sequence>
                                                    <xs:element name="bio" type="xs:string"/>
                                                    <xs:element name="lastName" type="xs:string"/>
                                                    <xs:element name="firstName" type="xs:string"/>
                                                    <xs:element name="penName" type="xs:string" minOccurs="0"/>
                                                </xs:sequence>
                                            </xs:complexType>
                                        </xs:element>
                                    </xs:sequence>
                                </xs:complexType>
                            </xs:element>
                            <xs:element name="quantity" type="xs:integer"/>
                            <xs:element name="price">
                                <xs:simpleType>
                                    <xs:restriction base="xs:decimal">
                                        <xs:minInclusive value="0.01"/>
                                    </xs:restriction>
                                </xs:simpleType>
                            </xs:element>
                        </xs:sequence>
                    </xs:complexType>
                </xs:element>
            </xs:sequence>
        </xs:complexType>
    </xs:element>

</xs:schema>